{
  "datapack_id": "productivity-performance",
  "version": "1.0.0",
  "created_at_utc": "2026-02-07T08:04:56Z",
  "tile": {
    "tile_id": "productivity-performance",
    "tile_label": "Is productivity improving?",
    "intent_tags": [
      "productivity",
      "efficiency",
      "economy"
    ],
    "persona_tags": [
      "policy_analyst",
      "public_user",
      "ai_agent"
    ],
    "elicitation_questions": [
      "Which place do you need?",
      "What period are you comparing?",
      "Do you need levels, rates, or index change?"
    ]
  },
  "data_card": {
    "card_id": "productivity-performance-card",
    "headline": "Productivity trend with component context",
    "summary": "Use output-per-hour as primary and validate with components.",
    "why_this_dataset": "Highest fit for intent, geography availability, and release discipline.",
    "why_not_others": [
      "Alternative series have mismatched geography or frequency.",
      "Some related series are provisional and not directly comparable."
    ],
    "geography_coverage": [
      "UK",
      "industry"
    ],
    "time_coverage": {
      "start_period": "2010",
      "end_period": "latest",
      "frequency": "quarterly"
    },
    "release_frequency": "quarterly",
    "revision_status": "mixed",
    "accessibility_notes": [
      "Include plain-language caveat summary above chart.",
      "Provide table view and downloadable CSV alternative.",
      "Do not rely on colour alone for chart distinction."
    ]
  },
  "primary_dataset": {
    "dataset_id": "labour-productivity-output-per-hour",
    "dataset_title": "Labour productivity (output per hour)",
    "dataset_url": "https://www.ons.gov.uk/economy/economicoutputandproductivity/productivitymeasures",
    "provider": "ONS",
    "dataset_family": "productivity",
    "geography_levels": [
      "UK",
      "industry"
    ],
    "time_granularity": "quarterly",
    "latest_release_date": "2025-12-20",
    "fitness_for_use_score": 84,
    "confidence": "medium",
    "explainability_note": "Primary productivity signal for efficiency trends.",
    "known_limitations": [
      "Measurement depends on output and hours quality."
    ],
    "comparability_warnings": [
      "Short-run moves may reflect composition shifts."
    ],
    "provenance": {
      "source_name": "Office for National Statistics",
      "source_url": "https://www.ons.gov.uk/",
      "retrieved_at": "2026-02-07T08:04:56Z",
      "licence": "Open Government Licence v3.0",
      "method_note": "Curated for MCP Geo dataset selection prototype using ONS statistical and derived indicator patterns.",
      "quality_note": "Illustrative sample; verify latest release metadata before production use."
    }
  },
  "related_datasets": [
    {
      "dataset_id": "gdp-hourly",
      "dataset_title": "GDP and hours worked",
      "dataset_url": "https://www.ons.gov.uk/economy/economicoutputandproductivity",
      "provider": "ONS",
      "dataset_family": "economy",
      "geography_levels": [
        "UK"
      ],
      "time_granularity": "quarterly",
      "latest_release_date": "2025-12-20",
      "fitness_for_use_score": 82,
      "confidence": "medium",
      "explainability_note": "Input components behind productivity.",
      "known_limitations": [
        "Hours estimates can revise."
      ],
      "comparability_warnings": [
        "Ensure same vintage alignment."
      ],
      "provenance": {
        "source_name": "Office for National Statistics",
        "source_url": "https://www.ons.gov.uk/",
        "retrieved_at": "2026-02-07T08:04:56Z",
        "licence": "Open Government Licence v3.0",
        "method_note": "Curated for MCP Geo dataset selection prototype using ONS statistical and derived indicator patterns.",
        "quality_note": "Illustrative sample; verify latest release metadata before production use."
      }
    },
    {
      "dataset_id": "real-compensation-per-hour",
      "dataset_title": "Real compensation per hour",
      "dataset_url": "https://www.ons.gov.uk/employmentandlabourmarket",
      "provider": "ONS",
      "dataset_family": "labour-market",
      "geography_levels": [
        "UK"
      ],
      "time_granularity": "quarterly",
      "latest_release_date": "2025-12-20",
      "fitness_for_use_score": 74,
      "confidence": "medium",
      "explainability_note": "Wage-productivity context.",
      "known_limitations": [
        "Method differences across sources."
      ],
      "comparability_warnings": [
        "Do not infer causality from co-movement alone."
      ],
      "provenance": {
        "source_name": "Office for National Statistics",
        "source_url": "https://www.ons.gov.uk/",
        "retrieved_at": "2026-02-07T08:04:56Z",
        "licence": "Open Government Licence v3.0",
        "method_note": "Curated for MCP Geo dataset selection prototype using ONS statistical and derived indicator patterns.",
        "quality_note": "Illustrative sample; verify latest release metadata before production use."
      }
    }
  ],
  "link_edges": [
    {
      "edge_id": "prod-to-gdp-hours",
      "from_dataset_id": "labour-productivity-output-per-hour",
      "to_dataset_id": "gdp-hourly",
      "link_type": "methodological_dependency",
      "link_reason": "Productivity derives from output and hours components.",
      "provenance": {
        "source_name": "Office for National Statistics",
        "source_url": "https://www.ons.gov.uk/",
        "retrieved_at": "2026-02-07T08:04:56Z",
        "licence": "Open Government Licence v3.0",
        "method_note": "Curated for MCP Geo dataset selection prototype using ONS statistical and derived indicator patterns.",
        "quality_note": "Illustrative sample; verify latest release metadata before production use."
      }
    },
    {
      "edge_id": "prod-to-compensation",
      "from_dataset_id": "labour-productivity-output-per-hour",
      "to_dataset_id": "real-compensation-per-hour",
      "link_type": "complementary_context",
      "link_reason": "Context for productivity-pay relationship analysis.",
      "provenance": {
        "source_name": "Office for National Statistics",
        "source_url": "https://www.ons.gov.uk/",
        "retrieved_at": "2026-02-07T08:04:56Z",
        "licence": "Open Government Licence v3.0",
        "method_note": "Curated for MCP Geo dataset selection prototype using ONS statistical and derived indicator patterns.",
        "quality_note": "Illustrative sample; verify latest release metadata before production use."
      }
    }
  ],
  "chart_templates": [
    {
      "chart_id": "productivity-performance-chart-1",
      "chart_type": "line",
      "purpose": "Show change over time with clear comparability notes.",
      "x_field": "period",
      "y_field": "index_or_growth",
      "accessibility_notes": [
        "Add data labels option.",
        "Offer keyboard-navigable table fallback."
      ]
    }
  ],
  "ai_safe_controls": {
    "misuse_risk_level": "medium",
    "required_caveat_display": true,
    "must_check_comparability": true,
    "must_show_release_date": true,
    "must_show_revision_status": true,
    "disallow_unqualified_ranking": true,
    "prompt_guardrails": [
      "Do not claim causal relationships without supporting design.",
      "State if geographies or vintages are not directly comparable.",
      "Always disclose if series is provisional or revised."
    ]
  }
}