{
  "datapack_id": "housing-affordability-local",
  "version": "1.0.0",
  "created_at_utc": "2026-02-07T08:04:56Z",
  "tile": {
    "tile_id": "housing-affordability-local",
    "tile_label": "Is housing becoming less affordable locally?",
    "intent_tags": [
      "housing",
      "affordability",
      "local-authority"
    ],
    "persona_tags": [
      "policy_analyst",
      "public_user",
      "ai_agent"
    ],
    "elicitation_questions": [
      "Which place do you need?",
      "What period are you comparing?",
      "Do you need levels, rates, or index change?"
    ]
  },
  "data_card": {
    "card_id": "housing-affordability-local-card",
    "headline": "Local housing affordability with rental context",
    "summary": "Use the affordability ratio as primary and add rental pressure for broader view.",
    "why_this_dataset": "Highest fit for intent, geography availability, and release discipline.",
    "why_not_others": [
      "Alternative series have mismatched geography or frequency.",
      "Some related series are provisional and not directly comparable."
    ],
    "geography_coverage": [
      "local-authority",
      "region",
      "country"
    ],
    "time_coverage": {
      "start_period": "2010",
      "end_period": "latest",
      "frequency": "annual"
    },
    "release_frequency": "annual",
    "revision_status": "mixed",
    "accessibility_notes": [
      "Include plain-language caveat summary above chart.",
      "Provide table view and downloadable CSV alternative.",
      "Do not rely on colour alone for chart distinction."
    ]
  },
  "primary_dataset": {
    "dataset_id": "house-price-to-earnings-ratio",
    "dataset_title": "House price to workplace-based earnings ratio",
    "dataset_url": "https://www.ons.gov.uk/peoplepopulationandcommunity/housing",
    "provider": "ONS",
    "dataset_family": "housing",
    "geography_levels": [
      "local-authority",
      "region",
      "country"
    ],
    "time_granularity": "annual",
    "latest_release_date": "2025-03-01",
    "fitness_for_use_score": 89,
    "confidence": "high",
    "explainability_note": "Primary affordability indicator across local areas.",
    "known_limitations": [
      "Ratio is sensitive to earnings denominator choice."
    ],
    "comparability_warnings": [
      "Avoid direct comparison with non-workplace earnings measures."
    ],
    "provenance": {
      "source_name": "Office for National Statistics",
      "source_url": "https://www.ons.gov.uk/",
      "retrieved_at": "2026-02-07T08:04:56Z",
      "licence": "Open Government Licence v3.0",
      "method_note": "Curated for MCP Geo dataset selection prototype using ONS statistical and derived indicator patterns.",
      "quality_note": "Illustrative sample; verify latest release metadata before production use."
    }
  },
  "related_datasets": [
    {
      "dataset_id": "private-rental-prices-index",
      "dataset_title": "Private rental prices index",
      "dataset_url": "https://www.ons.gov.uk/economy/inflationandpriceindices",
      "provider": "ONS",
      "dataset_family": "housing",
      "geography_levels": [
        "UK",
        "region"
      ],
      "time_granularity": "monthly",
      "latest_release_date": "2026-01-01",
      "fitness_for_use_score": 81,
      "confidence": "medium",
      "explainability_note": "Rental market pressure context.",
      "known_limitations": [
        "Regional detail may vary by period."
      ],
      "comparability_warnings": [
        "Rental and purchase affordability capture different populations."
      ],
      "provenance": {
        "source_name": "Office for National Statistics",
        "source_url": "https://www.ons.gov.uk/",
        "retrieved_at": "2026-02-07T08:04:56Z",
        "licence": "Open Government Licence v3.0",
        "method_note": "Curated for MCP Geo dataset selection prototype using ONS statistical and derived indicator patterns.",
        "quality_note": "Illustrative sample; verify latest release metadata before production use."
      }
    },
    {
      "dataset_id": "median-workplace-earnings",
      "dataset_title": "Median workplace-based earnings",
      "dataset_url": "https://www.ons.gov.uk/employmentandlabourmarket",
      "provider": "ONS",
      "dataset_family": "labour-market",
      "geography_levels": [
        "local-authority"
      ],
      "time_granularity": "annual",
      "latest_release_date": "2025-11-01",
      "fitness_for_use_score": 84,
      "confidence": "high",
      "explainability_note": "Denominator context for affordability ratio.",
      "known_limitations": [
        "Distributional context not captured by single median."
      ],
      "comparability_warnings": [
        "Use consistent geography and year."
      ],
      "provenance": {
        "source_name": "Office for National Statistics",
        "source_url": "https://www.ons.gov.uk/",
        "retrieved_at": "2026-02-07T08:04:56Z",
        "licence": "Open Government Licence v3.0",
        "method_note": "Curated for MCP Geo dataset selection prototype using ONS statistical and derived indicator patterns.",
        "quality_note": "Illustrative sample; verify latest release metadata before production use."
      }
    }
  ],
  "link_edges": [
    {
      "edge_id": "afford-to-rent",
      "from_dataset_id": "house-price-to-earnings-ratio",
      "to_dataset_id": "private-rental-prices-index",
      "link_type": "complementary_context",
      "link_reason": "Shows ownership and rental pressures together.",
      "provenance": {
        "source_name": "Office for National Statistics",
        "source_url": "https://www.ons.gov.uk/",
        "retrieved_at": "2026-02-07T08:04:56Z",
        "licence": "Open Government Licence v3.0",
        "method_note": "Curated for MCP Geo dataset selection prototype using ONS statistical and derived indicator patterns.",
        "quality_note": "Illustrative sample; verify latest release metadata before production use."
      }
    },
    {
      "edge_id": "afford-to-earnings",
      "from_dataset_id": "house-price-to-earnings-ratio",
      "to_dataset_id": "median-workplace-earnings",
      "link_type": "methodological_dependency",
      "link_reason": "Affordability measure depends on earnings series.",
      "provenance": {
        "source_name": "Office for National Statistics",
        "source_url": "https://www.ons.gov.uk/",
        "retrieved_at": "2026-02-07T08:04:56Z",
        "licence": "Open Government Licence v3.0",
        "method_note": "Curated for MCP Geo dataset selection prototype using ONS statistical and derived indicator patterns.",
        "quality_note": "Illustrative sample; verify latest release metadata before production use."
      }
    }
  ],
  "chart_templates": [
    {
      "chart_id": "housing-affordability-local-chart-1",
      "chart_type": "map",
      "purpose": "Show change over time with clear comparability notes.",
      "x_field": "area_code",
      "y_field": "ratio",
      "accessibility_notes": [
        "Add data labels option.",
        "Offer keyboard-navigable table fallback."
      ]
    }
  ],
  "ai_safe_controls": {
    "misuse_risk_level": "medium",
    "required_caveat_display": true,
    "must_check_comparability": true,
    "must_show_release_date": true,
    "must_show_revision_status": true,
    "disallow_unqualified_ranking": true,
    "prompt_guardrails": [
      "Do not claim causal relationships without supporting design.",
      "State if geographies or vintages are not directly comparable.",
      "Always disclose if series is provisional or revised."
    ]
  }
}